{
  "track_id": "mtg-jamendo-placeholder",
  "source_dataset": "MTG-Jamendo",
  "license": "CC-BY-placeholder",
  "source_url": "https://example.com/source-track",
  "prompt": "instrumental cinematic tension with recurring melodic motif",
  "prefix_window": {
    "start_seconds": 0,
    "end_seconds": 10
  },
  "generation_window": {
    "start_seconds": 10,
    "end_seconds": 40
  },
  "motif_window": {
    "start_seconds": 2,
    "end_seconds": 6
  },
  "recurrence_window": {
    "start_seconds": 24,
    "end_seconds": 30
  },
  "event_type": "motif_recurrence",
  "instrument_tags": ["piano", "strings"],
  "section_label": "continuation",
  "energy": 0.42,
  "spectral_centroid": 1840.5,
  "chroma_features_path": "outputs/features/mtg-jamendo-placeholder.chroma.npy",
  "manual_verification_status": "unverified",
  "notes": "Placeholder example. Replace with real MTG-Jamendo metadata."
}
